{
  "attempt_id": "attempt-1",
  "defect_adjudications": [],
  "host_events": [
    {
      "event": "merged_at",
      "evidence_locator": "github:owner/repo/commit/sha",
      "occurred_at": "2026-08-08T00:00:00Z",
      "subject_id": "sha"
    }
  ],
  "host_proof": {
    "event_digest": "sha256:0000000000000000000000000000000000000000000000000000000000000000",
    "evidence_locator": "github:owner/repo/commit/sha",
    "provider": "github"
  },
  "merged_sha_or_release_id": "sha",
  "observation_contract_digest": "sha256:0000000000000000000000000000000000000000000000000000000000000000",
  "observation_id": "observation-1",
  "observed_at": "2026-08-09T00:00:00Z",
  "raw_evidence_locators": [
    "github:owner/repo/commit/sha"
  ],
  "receipt_issuer": "protected-store:pilot-ledger",
  "schema_version": 4,
  "signals": [
    {
      "id": "real-use-smoke",
      "result": "pass"
    }
  ],
  "window_ended_at": "2026-08-09T00:00:00Z",
  "window_started_at": "2026-08-08T00:00:00Z"
}
